{
  "schema_version": 1,
  "source_dataset": "seed42-regimeA",
  "count": 6,
  "injected_rings": [
    {
      "truth_id": "T01",
      "entities": [
        "E005",
        "E019",
        "E007",
        "E003",
        "E022"
      ],
      "hidden_legs": []
    },
    {
      "truth_id": "T02",
      "entities": [
        "E030",
        "E016",
        "E021",
        "E032",
        "E017",
        "E009",
        "E010"
      ],
      "hidden_legs": []
    },
    {
      "truth_id": "T03",
      "entities": [
        "E008",
        "E002",
        "E015",
        "E026",
        "E031",
        "E023"
      ],
      "hidden_legs": []
    },
    {
      "truth_id": "T04",
      "entities": [
        "E014",
        "E006",
        "E025",
        "E027"
      ],
      "hidden_legs": [
        {
          "from": "E027",
          "to": "E014",
          "value": 50884705
        }
      ]
    },
    {
      "truth_id": "T05",
      "entities": [
        "E018",
        "E028",
        "E029",
        "E020",
        "E024",
        "E004",
        "E012"
      ],
      "hidden_legs": []
    },
    {
      "truth_id": "T06",
      "entities": [
        "E001",
        "E011",
        "E013",
        "E015"
      ],
      "hidden_legs": []
    }
  ]
}